{
  "version": 1,
  "name": "native_trace_worker_resumed",
  "kind": "native_trace",
  "input": {
    "run": {
      "version": 4,
      "workflow": "forge",
      "status": "running",
      "entry_task": "Inspect provider resume traces",
      "mode": "single_story",
      "runtime": {
        "adapter": "codex",
        "entrypoint": "praxis:forge"
      },
      "execution": {
        "mode": "autopilot",
        "fresh_context_per_story": true
      },
      "current": {
        "scope": "root",
        "slice_id": null,
        "artifact_dir": ".praxis",
        "stage": "rapid-implementing"
      },
      "routing": {
        "next_action": "run_stage",
        "next_stage": "rapid-implementing",
        "next_slice_id": null,
        "reason": "Awaiting resumed worker output.",
        "stop_reason_code": null,
        "boundary_handoff_path": null,
        "pending_worker_action": "await_stage_result",
        "resume_strategy": "prefer_resume_then_relaunch"
      },
      "timestamps": {
        "created_at": "2026-04-12T00:00:00Z",
        "updated_at": "2026-04-12T00:20:00Z"
      }
    },
    "events": [
      {
        "ts": "2026-04-12T00:05:00Z",
        "type": "provider_resume_failed",
        "adapter": "codex",
        "scope": "root",
        "slice_id": null,
        "artifact_dir": ".praxis",
        "stage": "rapid-implementing",
        "boundary_handoff_path": null,
        "worker_id": "wrk_root_impl_01",
        "requested_session_id": "sess-prev-123",
        "resolved_session_id": null,
        "resume_mode": "headless",
        "resume_record_path": ".praxis/runtime/resumes/codex/20260412T000500Z-wrk_root_impl_01.json",
        "reason_code": "provider_rejected",
        "reason": "The provider resume command failed."
      },
      {
        "ts": "2026-04-12T00:06:00Z",
        "type": "worker_resumed",
        "adapter": "codex",
        "scope": "root",
        "slice_id": null,
        "artifact_dir": ".praxis",
        "stage": "rapid-implementing",
        "boundary_handoff_path": null,
        "worker_id": "wrk_root_impl_01",
        "session_id": "sess-prev-123",
        "resume_mode": "headless",
        "resume_record_path": ".praxis/runtime/resumes/codex/20260412T000600Z-wrk_root_impl_01.json",
        "reason_code": "worker_resumed",
        "reason": "The worker resumed safely."
      }
    ]
  },
  "expected": {
    "pause_action": null,
    "resume_action": null,
    "run_status": "running",
    "last_stop_event_type": "provider_resume_failed",
    "last_stop_reason_code": "provider_rejected",
    "last_resume_event_type": "worker_resumed",
    "last_resume_action": null,
    "trace_stop_reason_code": null
  }
}
