{
  "version": 1,
  "name": "adapter_parity_resume",
  "kind": "adapter_parity",
  "input": {
    "codex_harness": {
      "version": 1,
      "adapter": "codex",
      "instructions_path": "AGENTS.md",
      "project_config_path": ".codex/config.toml",
      "hooks_path": ".codex/hooks.json",
      "agents_path": ".codex/agents",
      "worker_launch_command": "python3 -c \"import sys; sys.exit(0)\"",
      "extension_points": {
        "mcp_config_path": ".codex/extensions.md",
        "resources_path": null,
        "tool_overrides_path": null,
        "notes_path": ".codex/extensions.md"
      },
      "compatibility": {
        "settings_path": ".codex-plugin/settings.md",
        "hooks_path": ".codex-plugin/hooks",
        "subagents_path": ".codex-plugin/subagents"
      }
    },
    "claude_harness": {
      "version": 1,
      "adapter": "claude",
      "instructions_path": "CLAUDE.md",
      "project_config_path": ".claude/settings.json",
      "hooks_path": ".claude/hooks",
      "agents_path": ".claude/agents",
      "worker_launch_command": "python3 -c \"import sys; sys.exit(0)\"",
      "extension_points": {
        "mcp_config_path": ".claude/extensions.md",
        "resources_path": null,
        "tool_overrides_path": null,
        "notes_path": ".claude/extensions.md"
      },
      "compatibility": {
        "settings_path": ".claude-plugin/settings.md",
        "hooks_path": ".claude-plugin/hooks",
        "subagents_path": ".claude-plugin/subagents"
      }
    },
    "run": {
      "version": 4,
      "workflow": "forge",
      "status": "running",
      "entry_task": "Check adapter resume parity",
      "mode": "single_story",
      "runtime": {
        "adapter": "codex",
        "entrypoint": "praxis:forge"
      },
      "execution": {
        "mode": "autopilot",
        "fresh_context_per_story": true
      },
      "current": {
        "scope": "root",
        "slice_id": null,
        "artifact_dir": ".praxis",
        "stage": "rapid-implementing",
        "worker_id": "wrk_root_impl_01",
        "session_id": null
      },
      "routing": {
        "next_action": "run_stage",
        "next_stage": "rapid-implementing",
        "next_slice_id": null,
        "reason": "Awaiting rapid-implementing stage work.",
        "stop_reason_code": null,
        "boundary_handoff_path": null,
        "pending_worker_action": "resume_or_launch",
        "resume_strategy": "prefer_resume_then_relaunch"
      },
      "control": {
        "owner": "praxis.runtime.orchestrator",
        "manual_session_required": false,
        "last_transition_id": "tx_001",
        "recovery_status": "clean"
      },
      "budgets": {
        "run_max_turns": 400,
        "run_max_workers": 40,
        "soft_cost_usd": 25.0,
        "hard_cost_usd": 40.0
      },
      "policy": {
        "default_permission_profile": "planning",
        "require_fresh_review_worker": true
      },
      "checkpoints": {
        "pending_user_decision": null,
        "pending_review_gate": null
      },
      "timestamps": {
        "created_at": "2026-04-12T00:00:00Z",
        "updated_at": "2026-04-12T00:00:00Z"
      },
      "run_id": "run_20260412000000",
      "workflow_version": "vNext"
    },
    "prelaunch_session_id": "resume-prev-123",
    "prelaunch_timestamp": "2026-04-12T04:14:00Z",
    "locator_timestamp": "2026-04-12T04:14:30Z",
    "session_request": {
      "session_id": "resume-rotated-456",
      "source": "resume"
    },
    "timestamp": "2026-04-12T04:15:00Z"
  },
  "expected": {
    "semantic_parity": true
  }
}
