{
  "version": 1,
  "name": "resume_single_story",
  "kind": "resume",
  "input": {
    "timestamp": "2026-04-12T04:05:00Z",
    "run": {
      "version": 3,
      "workflow": "forge",
      "status": "failed",
      "entry_task": "Resume the interrupted story",
      "mode": "single_story",
      "runtime": {
        "adapter": "codex",
        "entrypoint": "praxis:forge"
      },
      "execution": {
        "mode": "autopilot",
        "fresh_context_per_story": true
      },
      "current": {
        "scope": "root",
        "slice_id": null,
        "artifact_dir": ".praxis",
        "stage": "rapid-implementing"
      },
      "routing": {
        "next_action": "run_stage",
        "next_stage": "rapid-implementing",
        "next_slice_id": null,
        "reason": "The process stopped unexpectedly.",
        "stop_reason_code": null,
        "boundary_handoff_path": null
      },
      "timestamps": {
        "created_at": "2026-04-12T00:00:00Z",
        "updated_at": "2026-04-12T00:00:00Z"
      }
    }
  },
  "expected": {
    "action": "resume_active",
    "run_status": "running",
    "next_action": "run_stage"
  }
}
