{
  "version": 1,
  "name": "handoff_budget_compaction",
  "kind": "handoff_budget",
  "input": {
    "story_id": "S-001",
    "next_story_id": "S-002",
    "summary": "SSSSSSSSSSSSSSSSSSSSSSSSSSSSSSSSSSSSSSSSSSSSSSSSSSSSSSSSSSSSSSSSSSSSSSSSSSSSSSSSSSSSSSSSSSSSSSSSSSSSSSSSSSSSSSSSSSSSSSSSSSSSSSSSSSSSSSSSSSSSSSSSSSSSSSSSSSSSSSSSSSSSSSSSSSSSSSSSSSSSSSSSSSSSSSSSSSSSSSSSSSSSSSSSSSSSSSSSSSSSSSSSSSSSSSSSSSSSSSSS",
    "carry_forward_context": [
      "Context item 1",
      "Context item 2",
      "Context item 3",
      "Context item 4",
      "Context item 5",
      "Context item 6"
    ],
    "changed_paths": [
      "src/praxis/runtime/a.py",
      "src/praxis/runtime/b.py",
      "src/praxis/runtime/c.py",
      "src/praxis/runtime/d.py",
      "src/praxis/runtime/e.py",
      "src/praxis/runtime/f.py",
      "src/praxis/runtime/g.py",
      "src/praxis/runtime/h.py",
      "src/praxis/runtime/i.py"
    ],
    "commit_meta": {
      "end_commit": "def2222"
    },
    "generated_at": "2026-04-12T04:20:00Z"
  },
  "expected": {
    "within_budget": true,
    "compaction_applied": true
  }
}
