{
  "version": 1,
  "name": "boundary_stop_test_gate",
  "kind": "boundary_stop",
  "input": {
    "timestamp": "2026-04-12T04:10:00Z",
    "run": {
      "version": 3,
      "workflow": "forge",
      "status": "running",
      "entry_task": "Praxis v3",
      "mode": "multi_slice",
      "runtime": {
        "adapter": "codex",
        "entrypoint": "praxis:forge"
      },
      "execution": {
        "mode": "autopilot",
        "fresh_context_per_story": true
      },
      "current": {
        "scope": "slice",
        "slice_id": "S-001",
        "artifact_dir": ".praxis/slices/S-001",
        "stage": "code-improving"
      },
      "routing": {
        "next_action": "run_stage",
        "next_stage": "code-improving",
        "next_slice_id": null,
        "reason": "S-001 is completing after improvements.",
        "stop_reason_code": null,
        "boundary_handoff_path": null
      },
      "timestamps": {
        "created_at": "2026-04-10T16:33:35Z",
        "updated_at": "2026-04-10T17:17:38Z"
      }
    },
    "story_ledger": {
      "version": 2,
      "execution_mode": "autopilot",
      "stories": {
        "order": [
          "S-001",
          "S-002"
        ],
        "active": "S-001",
        "last_completed": null,
        "items": {
          "S-001": {
            "artifact_dir": ".praxis/slices/S-001",
            "status": "active",
            "boundary_status": "in_progress",
            "handoff_path": null,
            "handoff_markdown_path": null,
            "carry_forward_from": null,
            "commit_meta": null,
            "boundary_reason_code": null,
            "boundary_reason": null,
            "stop_reason_code": null,
            "stop_reason": null
          },
          "S-002": {
            "artifact_dir": ".praxis/slices/S-002",
            "status": "queued",
            "boundary_status": "pending",
            "handoff_path": null,
            "handoff_markdown_path": null,
            "carry_forward_from": null,
            "commit_meta": null,
            "boundary_reason_code": null,
            "boundary_reason": null,
            "stop_reason_code": null,
            "stop_reason": null
          }
        }
      },
      "timestamps": {
        "created_at": "2026-04-10T17:17:38Z",
        "updated_at": "2026-04-10T17:17:38Z"
      }
    },
    "stage_result": {
      "version": 2,
      "stage": "code-improving",
      "artifact_dir": ".praxis/slices/S-001",
      "status": "completed",
      "summary_path": ".praxis/slices/S-001/improvement.md",
      "artifacts_written": [
        ".praxis/slices/S-001/improvement.md"
      ],
      "route": {
        "kind": "proceed",
        "next_stage": null,
        "next_slice_id": null,
        "reason": "S-001 is ready to finish."
      },
      "data": {
        "outcome_code": "improvement_ready"
      },
      "needs_user_input": false,
      "needs_confirmation": false
    },
    "commit_meta": {
      "start_commit": "abc1111",
      "end_commit": "def2222",
      "commits": [
        "abc1111",
        "def2222"
      ]
    },
    "handoff_data": {
      "summary": "S-001 completed.",
      "carry_forward_context": [],
      "changed_paths": [
        "src/praxis/runtime/story_boundary.py"
      ]
    },
    "dirty_paths": [],
    "gate_failures": [
      "test_gate_failed"
    ]
  },
  "expected": {
    "run_status": "waiting_for_user",
    "stop_reason_code": "test_gate_failed",
    "boundary_status": "blocked"
  }
}
