{
  "version": 1,
  "name": "routing_forge_sketch_ready",
  "kind": "routing",
  "input": {
    "timestamp": "2026-04-12T04:00:00Z",
    "run": {
      "version": 3,
      "workflow": "forge",
      "status": "running",
      "entry_task": "Route the sketch result",
      "mode": "single_story",
      "runtime": {
        "adapter": "codex",
        "entrypoint": "praxis:forge"
      },
      "execution": {
        "mode": "autopilot",
        "fresh_context_per_story": true
      },
      "current": {
        "scope": "root",
        "slice_id": null,
        "artifact_dir": ".praxis",
        "stage": "sketching-design"
      },
      "routing": {
        "next_action": "run_stage",
        "next_stage": "sketching-design",
        "next_slice_id": null,
        "reason": "Sketch in progress.",
        "stop_reason_code": null,
        "boundary_handoff_path": null
      },
      "timestamps": {
        "created_at": "2026-04-12T00:00:00Z",
        "updated_at": "2026-04-12T00:00:00Z"
      }
    },
    "stage_result": {
      "version": 2,
      "stage": "sketching-design",
      "artifact_dir": ".praxis",
      "status": "completed",
      "summary_path": ".praxis/sketch.md",
      "artifacts_written": [
        ".praxis/sketch.md"
      ],
      "route": {
        "kind": "proceed",
        "next_stage": null,
        "next_slice_id": null,
        "reason": "Sketch is ready."
      },
      "data": {
        "outcome_code": "sketch_ready"
      },
      "needs_user_input": false,
      "needs_confirmation": false
    }
  },
  "expected": {
    "action": "run_stage",
    "next_stage": "rapid-implementing",
    "stop_reason_code": null
  }
}
